<?xml version="1.0" encoding="UTF-8"?>
<!ELEMENT buch (kapitel+)>
<!ELEMENT kapitel (ueberschrift, absatz+)>
        <!ELEMENT ueberschrift (#PCDATA)>
        <!ELEMENT absatz (#PCDATA)>
<!ATTLIST buch verlag CDATA #REQUIRED>
<!ATTLIST kapitel type CDATA #IMPLIED>